{
  "document": {
    "type": "azure_sre_assessment_report",
    "title": "Azure SRE Agent - Reliability Assessment Report",
    "subtitle": "Production Environment Review",
    "classification": "CONFIDENTIAL - INTERNAL USE ONLY",
    "reporting_period": "July 2026",
    "version": "1.0",
    "generated_by": "Azure SRE Agent",
    "author": "Azure SRE Platform Team",
    "environment": "Production",
    "subscription_scope": "Enterprise Azure Landing Zone"
  },
  "template": {
    "use_background_images": true,
    "first_page_background": "templates/Page_1.png",
    "last_page_background": "templates/Page_2.png",
    "overlay_cover_content": true,
    "overlay_closing_content": true,
    "file_name": "templates/template.docx",
    "use_first_page_as_cover": true,
    "use_last_page_as_closing_page": true
  },
  "layout": {
    "mode": "free_flowing",
    "page_size": "A4",
    "orientation": "portrait",
    "generate_toc": true,
    "clickable_toc": true,
    "validate_no_overlap": true,
    "apply_proper_indentation": true,
    "prevent_word_breaks": true,
    "format_tables": true,
    "format_toc": true
  },
  "sections": [
    {
      "id": "executive-summary",
      "title": "Executive Summary",
      "level": 1,
      "type": "narrative",
      "content": "The Azure SRE Agent assessment reviewed production reliability, observability, operational readiness, and remediation planning across critical Azure resources. The generated report uses free-flowing pages with proper indentation and a navigable table of contents."
    },
    {
      "id": "key-findings",
      "title": "Key Findings",
      "level": 1,
      "type": "table",
      "columns": [
        "Finding ID",
        "Category",
        "Severity",
        "Resource",
        "Observation",
        "Impact",
        "Recommendation",
        "Status"
      ],
      "rows": [
        [
          "F-001",
          "Reliability",
          "High",
          "Azure SQL Database",
          "CPU utilization exceeded threshold during peak cycle.",
          "Potential performance degradation.",
          "Review autoscaling and SKU right-sizing.",
          "Open"
        ],
        [
          "F-002",
          "Monitoring",
          "Medium",
          "Azure Monitor",
          "Alert routing does not include all primary responders.",
          "Delayed incident response.",
          "Update action groups and escalation paths.",
          "In Progress"
        ]
      ],
      "caption": "Table 1: Sample reliability findings."
    },
    {
      "id": "recommendations",
      "title": "Recommendations",
      "level": 1,
      "type": "bullets",
      "content": [
        "Enable consistent alert routing for all production workloads.",
        "Review autoscaling policies for high-usage resources.",
        "Include human approval evidence before any remediation execution.",
        "Track remediation progress using a centralized operational dashboard."
      ]
    },
    {
      "id": "approval-status",
      "title": "Approval Status",
      "level": 2,
      "type": "callout",
      "content": "Remediation actions in this report are recommendations only. No remediation execution should occur without approved change evidence and explicit human-in-the-loop authorization."
    }
  ],
  "output": {
    "file_name": "azure-sre-assessment-report.pdf",
    "include_validation_summary": true,
    "include_render_preview": true
  }
}